{"event_id":"TE-1","occurred_at":"2026-08-05T12:00:00Z","project_id":"PROJECT-1","run_id":"RUN-1","attempt_id":"ATTEMPT-1","trace_id":"TRACE-1","authority_refs":["BL-DESIGN-1"],"variant_binding":{"agent_definition_ref":{"id":"AGT-CODER","version":"1.0.0","content_hash":"sha256:bbbbbbbbbbbbbbbbbbbbbbbbbbbbbbbbbbbbbbbbbbbbbbbbbbbbbbbbbbbbbbbb"},"prompt_template_ref":{"id":"PRM-CODER","version":"1.0.0","content_hash":"sha256:aaaaaaaaaaaaaaaaaaaaaaaaaaaaaaaaaaaaaaaaaaaaaaaaaaaaaaaaaaaaaaaa"},"rule_set_ref":{"id":"RS-TYPESCRIPT","version":"1.0.0","content_hash":"sha256:cccccccccccccccccccccccccccccccccccccccccccccccccccccccccccccccc"},"model_ref":"MODEL-CODING-1","tool_schema_version":"1.0.0","context_bundle_hash":"sha256:ffffffffffffffffffffffffffffffffffffffffffffffffffffffffffffffff"},"outcome":"PASSED","event_type":"RUN_COMPLETED"}
